{
  "schema_version": "1.0.0",
  "reviewed_at": "2026-07-11",
  "clean_room_policy": "concepts-only-no-code-or-prose",
  "disposition_semantics": {
    "adopt": "Approve the concept for an independent implementation backed by first-party evidence, product contracts, fixtures, and tests.",
    "already-addressed": "Retain the current independently implemented behavior; do not import the reviewed material.",
    "defer": "Keep the concept in the evidence backlog until scope, authority, sources, security, and test gates are satisfied.",
    "reject": "Do not incorporate the reviewed behavior because it conflicts with product, evidence, privacy, security, or maintenance boundaries."
  },
  "fork_survey": {
    "upstream_repository": "AgriciDaniel/claude-ads",
    "upstream_default_branch": "main",
    "upstream_head_sha": "283d9d4917cb7c4f2ce9181e125bb1970f74ab04",
    "enumerated_at": "2026-07-11",
    "method": "github-rest-paginated-forks-and-default-head-ancestry",
    "paginated_fork_count": 1026,
    "repository_counter_observed": 1023,
    "ancestor_or_equal_count": 1009,
    "non_ancestor_count": 17,
    "completeness": "complete",
    "non_ancestor_repository_ids": [
      "fork-andersonamaral2-claude-ads",
      "fork-xmilresearch-lab-claude-ads",
      "fork-louisgiuliani-claude-ads",
      "fork-chizee-claude-ads",
      "fork-zoeresonance-claude-ads",
      "fork-seeksi-claude-ads",
      "fork-imitrushi-claude-ads",
      "fork-qant-au-claude-ads",
      "fork-pankajthakur1907-claude-ads",
      "fork-tiqamitsharma-claude-ads",
      "fork-haruki1987-claude-ads",
      "fork-juliandickie-pro-marketing-ads",
      "fork-emolina95-claude-ads",
      "fork-josephcrown920-claude-ads",
      "fork-kutzki-antigravity-ads",
      "fork-ltshabari-claude-ads",
      "fork-redpointgroup-claude-ads"
    ]
  },
  "repositories": [
    {
      "id": "fork-andersonamaral2-claude-ads",
      "repository": "andersonamaral2/claude-ads",
      "relationship": "fork",
      "source_url": "https://github.com/andersonamaral2/claude-ads",
      "default_branch": "main",
      "reviewed_head_sha": "b661972ae2daadac5f8331fa7e6a8bf699c8fc53",
      "reviewed_at": "2026-07-11",
      "license_spdx": "MIT",
      "license_use": "same-project-metadata-only",
      "copy_policy": "concepts-only-no-code-or-prose",
      "head_review": {
        "method": "github-rest-compare",
        "compare_status": "ahead",
        "upstream_base_sha": "283d9d4917cb7c4f2ce9181e125bb1970f74ab04",
        "merge_base_sha": "283d9d4917cb7c4f2ce9181e125bb1970f74ab04",
        "ahead_by": 9,
        "behind_by": 0,
        "commit_count": 9,
        "changed_files": 1,
        "additions": 22,
        "deletions": 0,
        "surfaces": ["documentation", "verification-badge"]
      },
      "primary_disposition": "reject",
      "rationale": "The only surviving delta is recurring promotional verification markup without repository-local evidence for its score.",
      "actionable_concepts": [
        {
          "id": "RC-0001",
          "summary": "Continuously refreshed repository assurance claims",
          "disposition": "reject",
          "rationale": "Assurance must come from reproducible checks and retained evidence, not externally asserted badges or daily documentation churn.",
          "requirement_ids": ["REQ-CI-001", "REQ-EVL-001"]
        }
      ]
    },
    {
      "id": "fork-xmilresearch-lab-claude-ads",
      "repository": "xmilresearch-lab/claude-ads",
      "relationship": "fork",
      "source_url": "https://github.com/xmilresearch-lab/claude-ads",
      "default_branch": "main",
      "reviewed_head_sha": "4f70490445d71ebdd13012e907b531874e510747",
      "reviewed_at": "2026-07-11",
      "license_spdx": "NOASSERTION",
      "license_use": "unverified-metadata-only",
      "copy_policy": "concepts-only-no-code-or-prose",
      "head_review": {
        "method": "github-rest-compare",
        "compare_status": "diverged",
        "upstream_base_sha": "283d9d4917cb7c4f2ce9181e125bb1970f74ab04",
        "merge_base_sha": "80420c1205dc4775ddf84324b602079163fdd3a5",
        "ahead_by": 110,
        "behind_by": 47,
        "commit_count": 110,
        "changed_files": 101,
        "additions": 5,
        "deletions": 16007,
        "surfaces": ["destructive-replacement", "placeholder"]
      },
      "primary_disposition": "reject",
      "rationale": "The reviewed head removes the product and license and replaces the repository with a placeholder, so no usable product delta survives at the pinned head.",
      "actionable_concepts": [
        {
          "id": "RC-0002",
          "summary": "Whole-repository replacement unrelated to the portable paid-media skill",
          "disposition": "reject",
          "rationale": "A destructive placeholder head cannot supply independently testable product behavior and has no asserted license at the reviewed revision.",
          "requirement_ids": ["REQ-PKG-001", "REQ-SCP-001"]
        }
      ]
    },
    {
      "id": "fork-louisgiuliani-claude-ads",
      "repository": "louisgiuliani/claude-ads",
      "relationship": "fork",
      "source_url": "https://github.com/louisgiuliani/claude-ads",
      "default_branch": "main",
      "reviewed_head_sha": "d20b304c9320aea84d6cf9683351739d300d23f7",
      "reviewed_at": "2026-07-11",
      "license_spdx": "MIT",
      "license_use": "same-project-metadata-only",
      "copy_policy": "concepts-only-no-code-or-prose",
      "head_review": {
        "method": "github-rest-compare",
        "compare_status": "ahead",
        "upstream_base_sha": "283d9d4917cb7c4f2ce9181e125bb1970f74ab04",
        "merge_base_sha": "283d9d4917cb7c4f2ce9181e125bb1970f74ab04",
        "ahead_by": 2,
        "behind_by": 0,
        "commit_count": 2,
        "changed_files": 1,
        "additions": 25,
        "deletions": 0,
        "surfaces": ["upstream-sync", "workflow"]
      },
      "primary_disposition": "defer",
      "rationale": "Scheduled write-enabled merges reduce drift but bypass the deliberate review and release evidence required for the private v2 branch.",
      "actionable_concepts": [
        {
          "id": "RC-0003",
          "summary": "Detect upstream drift without automatically mutating the protected branch",
          "disposition": "defer",
          "rationale": "A future read-only drift report could be useful, but automated merges require branch protection, pinned actions, conflict handling, and release-gate tests.",
          "requirement_ids": ["REQ-CI-001", "REQ-SEC-001"]
        }
      ]
    },
    {
      "id": "fork-chizee-claude-ads",
      "repository": "chizee/claude-ads",
      "relationship": "fork",
      "source_url": "https://github.com/chizee/claude-ads",
      "default_branch": "main",
      "reviewed_head_sha": "4a64b6d79f635b5beaf0a63162ec6ee63a780107",
      "reviewed_at": "2026-07-11",
      "license_spdx": "MIT",
      "license_use": "same-project-metadata-only",
      "copy_policy": "concepts-only-no-code-or-prose",
      "head_review": {
        "method": "github-rest-compare",
        "compare_status": "ahead",
        "upstream_base_sha": "283d9d4917cb7c4f2ce9181e125bb1970f74ab04",
        "merge_base_sha": "283d9d4917cb7c4f2ce9181e125bb1970f74ab04",
        "ahead_by": 1,
        "behind_by": 0,
        "commit_count": 1,
        "changed_files": 1,
        "additions": 6,
        "deletions": 0,
        "surfaces": ["hard-reset", "upstream-sync"]
      },
      "primary_disposition": "reject",
      "rationale": "The configuration permits unstable upstream content and destructive hard resets, conflicting with preservation and review requirements.",
      "actionable_concepts": [
        {
          "id": "RC-0004",
          "summary": "Destructive synchronization from an unstable upstream branch",
          "disposition": "reject",
          "rationale": "Protected product history must never be replaced by an unattended hard reset.",
          "requirement_ids": ["REQ-CI-001", "REQ-SEC-001"]
        }
      ]
    },
    {
      "id": "fork-zoeresonance-claude-ads",
      "repository": "zoeresonance/claude-ads",
      "relationship": "fork",
      "source_url": "https://github.com/zoeresonance/claude-ads",
      "default_branch": "main",
      "reviewed_head_sha": "a404ca54034beeb383cde681c523fdeeb76ed0a4",
      "reviewed_at": "2026-07-11",
      "license_spdx": "MIT",
      "license_use": "same-project-metadata-only",
      "copy_policy": "concepts-only-no-code-or-prose",
      "head_review": {
        "method": "github-rest-compare",
        "compare_status": "diverged",
        "upstream_base_sha": "283d9d4917cb7c4f2ce9181e125bb1970f74ab04",
        "merge_base_sha": "402ba63b9af56c0573766fb0ae8d7b56dc13a674",
        "ahead_by": 101,
        "behind_by": 30,
        "commit_count": 101,
        "changed_files": 39,
        "additions": 14632,
        "deletions": 0,
        "surfaces": ["account-connection", "client-artifacts", "hosted-dashboard"]
      },
      "primary_disposition": "reject",
      "rationale": "The delta is a separate hosted application and includes named client artifacts, which conflicts with the portable skill and repository privacy boundary.",
      "actionable_concepts": [
        {
          "id": "RC-0005",
          "summary": "Hosted performance views backed by account connections",
          "disposition": "defer",
          "rationale": "A hosted product requires a distinct threat model, consent model, data lifecycle, tenancy boundary, and sanitized fixtures before it can enter scope.",
          "requirement_ids": ["REQ-INT-001", "REQ-SEC-002", "REQ-SEC-004"]
        }
      ]
    },
    {
      "id": "fork-seeksi-claude-ads",
      "repository": "seeksi/claude-ads",
      "relationship": "fork",
      "source_url": "https://github.com/seeksi/claude-ads",
      "default_branch": "main",
      "reviewed_head_sha": "73f9879a0b4abf0396b6cc22dc7251b678a5595d",